{
    "country": "Ukraine",
    "countryCode": "UA",
    "capital": {
        "city": "Kyiv",
        "longitude": 30.5167,
        "latitude": 50.4333,
        "weatherConditions": {
            "visibility": 10000,
            "temperature": {
                "degrees": "Celsius",
                "current": 10.0
            },
            "pressure": 1000,
            "humidity": 50,
            "wind": {
                "speed": 10.0,
                "deg": 100
            }
        }
    },
    "lastUpdated": "2000-01-01T00:00:00.000Z"
}